{
  "schema": "afi.analyst-strategy-config.v1",
  "analystId": "froggy",
  "strategyId": "trend_pullback_v1",
  "strategyVersion": "1.0.0",
  "pipelineRef": {
    "pipelineId": "froggy-trend-pullback",
    "pipelineVersion": "v1.3.0",
    "manifestHash": {
      "algorithm": "sha256",
      "canonicalizationVersion": "afi.hash.v1",
      "domainTag": "afi.d2.composition-manifest",
      "value": "df3372dadaca1595d0e6d2f6bad9464ccc9abb7106e9f5b7111df148a145bc4f"
    }
  },
  "scorerRef": {
    "pluginId": "afi-scorer-froggy-trend-pullback",
    "pluginVersion": "1.0.0"
  },
  "uwrProfileRef": {
    "profileId": "uwr-weighted-lifts-v0.1"
  },
  "mappingRef": {
    "mappingId": "froggy-trend-pullback",
    "version": "1.3.0"
  },
  "decayConfig": {
    "ratio": {
      "barsPerHalfLife": 12,
      "unknownTimeframeMinutes": 5
    }
  },
  "metadata": {
    "note": "Non-authoritative, hash-excluded lineage of this configuration version (D-CFG-5(4): the version identity IS analystConfigHash; a superseded version survives on every record sealed under it and in git history).",
    "supersedes": [
      {
        "analystConfigHash": "300783e4f93ae07b2d758a3780b03cfbf6e4742bb4e0e5c9e06fb54c1df1ff99",
        "act": "DEM-GOV DEM-PRODUCER-CANDLE — mappingRef froggy-trend-pullback 1.2.0 (2026-08-25)"
      },
      {
        "analystConfigHash": "5cb9b7a4652f3cfaa31d8a069c14c3282bbdf9354443badb033b05b01fd01e22",
        "act": "DEM-GOV DEM-PRODUCER-PLAN — mappingRef froggy-trend-pullback 1.1.0 (2026-08-25)"
      },
      {
        "analystConfigHash": "aa8cf5cfd918ae9a80532b735db3236b708ce0cb82778d845b35220627dab479",
        "act": "DEM-GOV DEM-BIND step (d) — mappingRef froggy-trend-pullback 1.0.0 (2026-08-23)"
      }
    ]
  },
  "nodeOverrides": {
    "technical": {
      "config": {
        "htf": {
          "dailyTimeframe": "1d",
          "weeklyTimeframe": "1w",
          "htfCandleLimit": 100
        }
      }
    }
  }
}
