{
  "schema": "afi.analyst-strategy-config.v1",
  "analystId": "atlas-probe",
  "strategyId": "multi_branch_v1",
  "strategyVersion": "1.0.0",
  "pipelineRef": {
    "pipelineId": "atlas-multi-branch",
    "pipelineVersion": "v1.1.0",
    "manifestHash": {
      "algorithm": "sha256",
      "canonicalizationVersion": "afi.hash.v1",
      "domainTag": "afi.d2.composition-manifest",
      "value": "474b2daa714b116d977858dfbf1e04be6a36e4f09613d0b72f65ff62db4a13d2"
    }
  },
  "scorerRef": {
    "pluginId": "afi-scorer-atlas-probe",
    "pluginVersion": "1.0.0"
  },
  "uwrProfileRef": {
    "profileId": "uwr-weighted-lifts-v0.1"
  },
  "mappingRef": {
    "mappingId": "froggy-trend-pullback",
    "version": "1.0.0"
  },
  "decayConfig": {
    "ref": {
      "templateId": "decay-scalp-v1"
    }
  }
}
